title,content,source,credible
"Scientists Discover New Exoplanet","Researchers at NASA have confirmed the discovery of a new exoplanet using advanced telescopic technology. The planet, located 100 light-years away, shows potential for habitability.","reuters",1
"SHOCKING: Aliens Found on Earth!","You won't believe what happened next! Click here to see the unbelievable truth about aliens living among us! This will change everything!","unknown",0
"Economic Report Shows Steady Growth","The latest quarterly economic report indicates steady growth in the manufacturing sector, with unemployment rates declining by 0.2%.","bbc",1
"BREAKING: Celebrity Secret Revealed","This shocking revelation will change everything you thought you knew! Must read now! You won't believe this incredible secret!","gossip",0
"Climate Study Published in Nature","A comprehensive study on climate change effects has been published in the peer-reviewed journal Nature, showing significant temperature increases.","guardian",1
"Miracle Cure Discovered!","Doctors hate this one simple trick! Unbelievable results that will shock you! Click here to learn the secret they don't want you to know!","unknown",0
"New COVID Variant Detected","Health officials have identified a new variant of COVID-19 with increased transmissibility. Vaccination remains the primary defense.","cnn",1
"URGENT: Government Conspiracy Exposed","Breaking news that they don't want you to see! This shocking truth will blow your mind! Share before it gets deleted!","conspiracy",0